{
  "$schema": "https://raw.githubusercontent.com/thoughtoinnovate/nix/main/schemas/home-weave-v3.schema.json",
  "schemaVersion": 3,
  "distribution": {
    "name": "company-home-weave",
    "parent": "github:thoughtoinnovate/nix"
  },
  "defaults": {
    "profile": "work"
  },
  "profiles": {
    "work": {
      "extends": "development",
      "shells": ["zsh"],
      "primaryShell": "zsh",
      "exclude": {},
      "packageGroups": [],
      "dotfiles": [],
      "packages": {"nix": []},
      "platforms": {
        "macos": {"packages": {"providers": {}}},
        "linux": {"packages": {"providers": {}}}
      }
    }
  }
}
